{"schema_version":"synth.lineage-edge.v1","edge_id":"edge-produced-ember","edge_type":"produced","source":{"kind":"run","id":"run-ember-001","digest":"sha256:aaaaaaaaaaaaaaaaaaaaaaaaaaaaaaaaaaaaaaaaaaaaaaaaaaaaaaaaaaaaaaaa"},"target":{"kind":"candidate","id":"cand_craftax_ember","digest":"sha256:045eb97ecd2b1ac50f6baf62a207836029adb44a4e3c2c48ce7487a5ef9d42f5"},"evidence_refs":[{"kind":"artifact","uri":"cas://sha256/ember","digest":"sha256:aaaaaaaaaaaaaaaaaaaaaaaaaaaaaaaaaaaaaaaaaaaaaaaaaaaaaaaaaaaaaaaa"}],"recorded_at":"2026-08-24T14:00:00Z","digest":"sha256:d1a92f7ea22cde67bf682d2d5bc311615c7dabcdc319ddd3419ecd4df96a5eeb"}
